	<!ELEMENT OrgType (body)>

	<!ELEMENT body (entry)*>
	<!ELEMENT entry (orgAbbr, orgType)>

	<!ELEMENT orgAbbr (#PCDATA)>
	<!ELEMENT orgType (#PCDATA)>
